title,company,ratings,reviews,experience,salary,location,tags,url
Lead Full-Stack Developer,BNY Mellon,4.2,2840 Reviews,0-3 Yrs,Not disclosed,Pune, quality management assurance coding finance end front full stack management,https://www.naukri.com/job-listings-lead-full-stack-developer-bny-mellon-international-operations-india-pune-0-to-3-years-150523501819
Software Developer,Godigitell,4.5,5 Reviews,0-2 Yrs,Not disclosed,Chennai, software backend development front side coding dbms end,https://www.naukri.com/job-listings-software-developer-godigitell-chennai-0-to-2-years-100523500987
Jr. Software Developers,Suvarna Technosoft,3.2,35 Reviews,0-1 Yrs,Not disclosed,Hyderabad/Secunderabad, angular JS ASP.Net front end development backend sql software angular,https://www.naukri.com/job-listings-jr-software-developers-suvarna-technosoft-hyderabad-secunderabad-0-to-1-years-040523006695
"Android Developer 
",Shujabits Infotech Solutions,3.9,11 Reviews,0-2 Yrs,Not disclosed,Navi Mumbai, Android Security. Android Studio API integration Android UI github gitlab integration mysql,https://www.naukri.com/job-listings-android-developer-shujabits-infotech-solutions-navi-mumbai-0-to-2-years-160523905540
UI Developer and Ionic Framework,Experts In Solutions,5.0,3 Reviews,0-4 Yrs,1.5-5 Lacs PA,Chennai, Angularjs CSS Ionic Framework Capacitors Angular html ui sql,https://www.naukri.com/job-listings-ui-developer-and-ionic-framework-experts-in-solutions-chennai-0-to-4-years-131221001783
Full Stack Developer,Futures First,3.6,56 Reviews,0-2 Yrs,Not disclosed,Gurgaon/Gurugram, life cycle javascript python stack development front end end development life cycle,https://www.naukri.com/job-listings-full-stack-developer-futures-first-info-services-pvt-ltd-gurgaon-gurugram-0-to-2-years-120523501293
Node Js Developer,Infinite Open Source Solutions,2.6,11 Reviews,0-2 Yrs,Not disclosed,Calicut/Kozhikode, javascript front end development css end basic program cs,https://www.naukri.com/job-listings-node-js-developer-infinite-open-source-solutions-calicut-kozhikode-0-to-2-years-100523503287
Junior Python Developer,Soften Technologies,4.0,44 Reviews,0-2 Yrs,Not disclosed,Kochi/Cochin, Django backend web technologies development front computer science science end,https://www.naukri.com/job-listings-junior-python-developer-soften-technologies-kochi-cochin-0-to-2-years-151222011394
Python Developer,Infinite Open Source Solutions,2.6,11 Reviews,0-2 Yrs,Not disclosed,Calicut/Kozhikode, development html javascript python postgresql front end mysql django,https://www.naukri.com/job-listings-python-developer-infinite-open-source-solutions-calicut-kozhikode-0-to-2-years-100523503289
React Js Developer,Ewall Solutions,3.1,6 Reviews,0-3 Yrs,Not disclosed,"Madurai, Tirupur/Tiruppur, Salem, Chennai, Tiruchirapalli/Trichy, Coimbatore", react.js improvement team development front team building technology continuous improvement,https://www.naukri.com/job-listings-react-js-developer-ewall-solutions-private-limited-madurai-tirupur-tiruppur-salem-chennai-tiruchirapalli-trichy-coimbatore-0-to-3-years-080523501424
