title,company,ratings,reviews,experience,salary,location,tags,url
Full Stack Developer,Highrise Solutions,4.7,2 Reviews,0-5 Yrs,Not disclosed,Pune, analytics software front embedded systems javascript integration application stack,https://www.naukri.com/job-listings-full-stack-developer-highrise-solutions-pune-0-to-5-years-210423500478
Rpa Developer,Befree Business,3.6,110 Reviews,0-2 Yrs,Not disclosed,Gandhinagar, Rpa Ui Path uipath Blue Prism development ui process automation automation process,https://www.naukri.com/job-listings-rpa-developer-befree-business-resourcing-llp-gandhinagar-0-to-2-years-200423008437
Junior Full Stack Developer,Websitelearners,3.2,7 Reviews,0-3 Yrs,Not disclosed,Chennai, development dbms end database design project project management programming design,https://www.naukri.com/job-listings-junior-full-stack-developer-websitelearners-chennai-0-to-3-years-190423501324
Web Designer,Tesla Outsourcing Services,4.3,24 Reviews,0-3 Yrs,1-4.5 Lacs PA,Ahmedabad, PSD Ux Design Web Designing Responsive Web Design Photoshop jquery cs interfaces,https://www.naukri.com/job-listings-web-designer-tesla-outsourcing-services-ahmedabad-0-to-3-years-210423006942
UI Trainee,Resource One It Solutions,4.5,15 Reviews,0-0 Yrs,1.75-2 Lacs PA,Hyderabad/Secunderabad(Prashant Hills), CSS Javascript HTML cs frontend development training full stack development,https://www.naukri.com/job-listings-ui-trainee-resource-one-it-solutions-hyderabad-secunderabad-0-to-0-years-070423000092
Embedded Software Developer,Elpis It Solutions,3.7,9 Reviews,0-5 Yrs,Not disclosed,Bangalore/Bengaluru, embedded systems linux embedded development development microcontroller embedded c c embedded software development,https://www.naukri.com/job-listings-embedded-software-developer-elpis-it-solutions-pvt-ltd-bangalore-bengaluru-0-to-5-years-270423009366
Software Developer,Testsigma Software Technologies,4.7,29 Reviews,0-5 Yrs,10-20 Lacs PA,"Hyderabad/Secunderabad, Chennai, Bangalore/Bengaluru", Software Installation Java Hibernate SQL Android core jquery plsql,https://www.naukri.com/job-listings-software-developer-testsigma-software-technologies-hyderabad-secunderabad-chennai-bangalore-bengaluru-0-to-5-years-190423010278
Associate Software Developer,Euronext,3.6,3 Reviews,0-2 Yrs,Not disclosed,Bangalore/Bengaluru, software machine javascript coding system program linux software development,https://www.naukri.com/job-listings-associate-software-developer-euronext-bangalore-bengaluru-0-to-2-years-170423501785
Software Engineer/ .Net Developer,Ultimate Technology Solutions,4.8,8 Reviews,0-5 Yrs,9-19 Lacs PA,"Hyderabad/Secunderabad, Bangalore/Bengaluru, Mumbai (All Areas)", .Net Software Consultant Software Designer SQL Software Programmer jquery javascript cs,https://www.naukri.com/job-listings-software-engineer-net-developer-ultimate-technology-solutions-hyderabad-secunderabad-bangalore-bengaluru-mumbai-all-areas-0-to-5-years-200423007643
Java Back End Developer,Infilytics,4.4,2 Reviews,0-5 Yrs,4-8 Lacs PA,Rajkot, Core Java Development program boot java core coding development java programming,https://www.naukri.com/job-listings-java-back-end-developer-infilytics-rajkot-0-to-5-years-010523003219
IOS DEVELOPER FRESHER,Monarchy Infotech,5.0,6 Reviews,0-2 Yrs,Not disclosed,Surat, backend development application mobile applications io cloud ios ios development,https://www.naukri.com/job-listings-ios-developer-fresher-monarchy-infotech-surat-0-to-2-years-250423502082
Urgent Requirement For Salesforce Trainee/Developer at Damco Solutions,Damco Solutions,3.4,162 Reviews,0-2 Yrs,Not disclosed,Delhi / NCR, Lightning Cloud Salesforce workflow process service cloud process builder aura,https://www.naukri.com/job-listings-urgent-requirement-for-salesforce-trainee-developer-at-damco-solutions-damco-solutions-delhi-ncr-0-to-2-years-010523000863
"Software Trainee, Software Developer, Software Tester",Marriage Onix,3.2,36 Reviews,0-4 Yrs,Not disclosed,"Kolkata, Hyderabad/Secunderabad, Pune, Ahmedabad, Gurgaon/Gurugram, Chennai, Bangalore/Bengaluru, Delhi / NCR, Mumbai (All Areas)", c++ software testing HTML SQL java development training css,https://www.naukri.com/job-listings-software-trainee-software-developer-software-tester-marriage-onix-kolkata-hyderabad-secunderabad-pune-ahmedabad-gurgaon-gurugram-chennai-bangalore-bengaluru-delhi-ncr-mumbai-all-areas-0-to-4-years-200722006881
Trainee Software Developer,MarriageOnix,3.2,36 Reviews,0-5 Yrs,Not disclosed,"Kolkata, Hyderabad/Secunderabad, Pune, Ahmedabad, Gurgaon/Gurugram, Chennai, Bangalore/Bengaluru, Delhi / NCR, Mumbai (All Areas)", Web Designing SQL html training software support c++ desktop support desktop,https://www.naukri.com/job-listings-trainee-software-developer-marriageonix-kolkata-hyderabad-secunderabad-pune-ahmedabad-gurgaon-gurugram-chennai-bangalore-bengaluru-delhi-ncr-mumbai-all-areas-0-to-5-years-031222005047
"Software Developer, Software Tester, Digital Marketer",MarriageOnix,3.2,36 Reviews,0-5 Yrs,Not disclosed,"Kolkata, Hyderabad/Secunderabad, Pune, Ahmedabad, Gurgaon/Gurugram, Chennai, Bangalore/Bengaluru, Delhi / NCR, Mumbai (All Areas)", Web Designing SQL fresher Python cs software testing software development development,https://www.naukri.com/job-listings-software-developer-software-tester-digital-marketer-marriageonix-kolkata-hyderabad-secunderabad-pune-ahmedabad-gurgaon-gurugram-chennai-bangalore-bengaluru-delhi-ncr-mumbai-all-areas-0-to-5-years-010123001203
